{"artifact": {"content_digest": "sha256:8e554bca6e1c00781d1ee15cac2b4644c656e1a7becd13617eb4d46382e7096d", "identity": "sha256:8e554bca6e1c00781d1ee15cac2b4644c656e1a7becd13617eb4d46382e7096d", "producer": "mncs-compiler", "producer_contract": "mncs.compiler.application-build/4"}, "legal_conclusion": "NOT_MADE", "lineage": {"relationships": [{"evidence": [{"reference": "mncs-compiler:application-build-result/4/sha256:868d4d753a3e1b6194434ea11765440ebbd67cb07ea24280754c751c80d6a55c/sha256:a9742739f396aa49ac26fdf6399b60bbf6fc3db56d0d36e4189e90a9705f3821/sha256:8e554bca6e1c00781d1ee15cac2b4644c656e1a7becd13617eb4d46382e7096d", "state": "declared"}, {"reference": "mncs-compiler:source-snapshot/sha256:868d4d753a3e1b6194434ea11765440ebbd67cb07ea24280754c751c80d6a55c/file/0", "sha256": "9fb8d218ab699f314e6e872f94322bb329b9529945f9b3fc69bbf61af281da5a", "state": "declared"}, {"reference": "mncs-compiler:source/root/mncs-rights-provenance:examples/rights-handoff.mncs", "state": "declared"}], "evidence_state": "declared", "from": "mncs-compiler:source-snapshot/sha256:868d4d753a3e1b6194434ea11765440ebbd67cb07ea24280754c751c80d6a55c/file/0", "relation": "compiled-from", "to": "mncs-compiler:artifact/sha256:8e554bca6e1c00781d1ee15cac2b4644c656e1a7becd13617eb4d46382e7096d"}, {"evidence": [{"reference": "mncs-compiler:application-build-result/4/sha256:868d4d753a3e1b6194434ea11765440ebbd67cb07ea24280754c751c80d6a55c/sha256:a9742739f396aa49ac26fdf6399b60bbf6fc3db56d0d36e4189e90a9705f3821/sha256:8e554bca6e1c00781d1ee15cac2b4644c656e1a7becd13617eb4d46382e7096d", "state": "declared"}, {"reference": "mncs-compiler:source-snapshot/sha256:868d4d753a3e1b6194434ea11765440ebbd67cb07ea24280754c751c80d6a55c", "sha256": "868d4d753a3e1b6194434ea11765440ebbd67cb07ea24280754c751c80d6a55c", "state": "declared"}, {"reference": "mncs-compiler:dependency-graph/sha256:a9742739f396aa49ac26fdf6399b60bbf6fc3db56d0d36e4189e90a9705f3821", "sha256": "a9742739f396aa49ac26fdf6399b60bbf6fc3db56d0d36e4189e90a9705f3821", "state": "declared"}, {"reference": "mncs-compiler:application-ssa-closure/1:b494356a6b95c950e1b337a356df914716fa40169b57798761af25bd1f027ff7", "state": "declared"}, {"reference": "mncs-compiler:probe-executable/sha256:254236f7d45d3de55916aa53daf8da5de262ee555d60b3568570f99196375160", "sha256": "254236f7d45d3de55916aa53daf8da5de262ee555d60b3568570f99196375160", "state": "declared"}, {"reference": "mncs-compiler:stage0-toolchain-description/sha256:d0894f74c437e1481af144417cccbb2ddeabe67ad91110c7d8c8277a3fc59237", "sha256": "d0894f74c437e1481af144417cccbb2ddeabe67ad91110c7d8c8277a3fc59237", "state": "declared"}, {"reference": "mncs-store:ses_c510d6b818542581:capability-invocation-artifacts:5fd1397083db952778517d3634a96f4455a5dc96c3a3cbe144f167cdd99f121c", "state": "directly-observed"}, {"reference": "mncs-compiler:selected-ssa/mncs:compiler:compiler-artifact:c8efdf2f479a723f0a55f44aafab15d7c62ad45178a079aedb8da7fdefecd64a", "state": "declared"}], "evidence_state": "declared", "from": "mncs-compiler:application-build-result/4/sha256:868d4d753a3e1b6194434ea11765440ebbd67cb07ea24280754c751c80d6a55c/sha256:a9742739f396aa49ac26fdf6399b60bbf6fc3db56d0d36e4189e90a9705f3821/sha256:8e554bca6e1c00781d1ee15cac2b4644c656e1a7becd13617eb4d46382e7096d", "relation": "transformed-by", "to": "mncs-compiler:artifact/sha256:8e554bca6e1c00781d1ee15cac2b4644c656e1a7becd13617eb4d46382e7096d"}], "source_snapshot_identity": "sha256:868d4d753a3e1b6194434ea11765440ebbd67cb07ea24280754c751c80d6a55c", "state": "partial", "transformation": {"event_ref": "mncs-compiler:application-build-result/4/sha256:868d4d753a3e1b6194434ea11765440ebbd67cb07ea24280754c751c80d6a55c/sha256:a9742739f396aa49ac26fdf6399b60bbf6fc3db56d0d36e4189e90a9705f3821/sha256:8e554bca6e1c00781d1ee15cac2b4644c656e1a7becd13617eb4d46382e7096d", "evidence": [{"reference": "mncs-compiler:application-build-result/4/sha256:868d4d753a3e1b6194434ea11765440ebbd67cb07ea24280754c751c80d6a55c/sha256:a9742739f396aa49ac26fdf6399b60bbf6fc3db56d0d36e4189e90a9705f3821/sha256:8e554bca6e1c00781d1ee15cac2b4644c656e1a7becd13617eb4d46382e7096d", "state": "declared"}, {"reference": "mncs-compiler:source-snapshot/sha256:868d4d753a3e1b6194434ea11765440ebbd67cb07ea24280754c751c80d6a55c", "sha256": "868d4d753a3e1b6194434ea11765440ebbd67cb07ea24280754c751c80d6a55c", "state": "declared"}, {"reference": "mncs-compiler:dependency-graph/sha256:a9742739f396aa49ac26fdf6399b60bbf6fc3db56d0d36e4189e90a9705f3821", "sha256": "a9742739f396aa49ac26fdf6399b60bbf6fc3db56d0d36e4189e90a9705f3821", "state": "declared"}, {"reference": "mncs-compiler:application-ssa-closure/1:b494356a6b95c950e1b337a356df914716fa40169b57798761af25bd1f027ff7", "state": "declared"}, {"reference": "mncs-compiler:probe-executable/sha256:254236f7d45d3de55916aa53daf8da5de262ee555d60b3568570f99196375160", "sha256": "254236f7d45d3de55916aa53daf8da5de262ee555d60b3568570f99196375160", "state": "declared"}, {"reference": "mncs-compiler:stage0-toolchain-description/sha256:d0894f74c437e1481af144417cccbb2ddeabe67ad91110c7d8c8277a3fc59237", "sha256": "d0894f74c437e1481af144417cccbb2ddeabe67ad91110c7d8c8277a3fc59237", "state": "declared"}, {"reference": "mncs-store:ses_c510d6b818542581:capability-invocation-artifacts:5fd1397083db952778517d3634a96f4455a5dc96c3a3cbe144f167cdd99f121c", "state": "directly-observed"}, {"reference": "mncs-compiler:selected-ssa/mncs:compiler:compiler-artifact:c8efdf2f479a723f0a55f44aafab15d7c62ad45178a079aedb8da7fdefecd64a", "state": "declared"}], "evidence_state": "declared", "kind": "compilation", "toolchain_identity": "mncs-compiler:probe-executable/sha256:254236f7d45d3de55916aa53daf8da5de262ee555d60b3568570f99196375160"}}, "rights": {"compatibility": "unknown", "context_identity": null, "contributing_manifests": [{"evidence_state": "directly-observed", "license_expression_ref": "mncs-rights-provenance:examples/rights-handoff.RIGHTS.json#/rights/distribution_license", "manifest_digest": "sha256:031573584bc68dd6941de9a3e9c6b07ce202ac0fd10491cd1ec47606d3d88b52", "manifest_identity": "5a396d817643ad15c84ffb50d6be80025e1a4508b1dfb4420aee8478ccd55834", "obligations_ref": "mncs-rights-provenance:examples/rights-handoff.RIGHTS.json#/rights", "reference": "mncs-rights-provenance:examples/rights-handoff.RIGHTS.json", "rights_state": "unresolved"}], "state": "review"}, "schema_version": "mncs.rights-provenance.native-artifact-binding/0.1.0"}
